{
  "id": "bundesrat-rechtskraftig",
  "version": "0.2.0",
  "inputSlug": "bundesrat-rechtskraftig",
  "captainInputValue": "Der Bundesrat unterschrieb den EU-Vertrag rechtskräftig bevor Volk und Parlament darüber entschieden haben",
  "language": "de",
  "status": "draft",
  "expectedInputClassification": "multi_assertion_input",
  "ambiguityPolicy": "must_disclose",
  "ambiguityPolicyRationale": "The input combines true procedural chronology with an ambiguous legal/procedural term. The primary/default reading of `rechtskräftig` is final legal force or entry into force; a less likely secondary reading treats the signed text as formally signed/authenticated/fixed while explicitly preserving that the treaty/package is not yet in force. Reports must disclose the competing reading they do not pursue.",
  "curation": {
    "curator": "Codex GPT-5 (Lead Developer draft)",
    "adjudicator": null,
    "peerReviewer": null,
    "createdAt": "2026-06-06T00:00:00Z",
    "lastRevalidatedAt": "2026-06-06T22:03:12Z",
    "revalidateAfter": "2026-09-06T00:00:00Z",
    "roleSeparationMode": "multi_agent_draft"
  },
  "validityWindow": {
    "referenceTime": "2026-06-06T00:00:00Z",
    "validFrom": "2026-06-06T00:00:00Z",
    "validThrough": null,
    "currentSnapshot": true
  },
  "sourceSnapshots": [
    {
      "id": "SRC_ADMIN_PACKAGE_OVERVIEW_20260313",
      "url": "https://www.admin.ch/de/paket-schweiz-eu",
      "archiveUrl": null,
      "localPath": "Docs/AGENTS/Reference_Dossiers/snapshots/bundesrat-shared/v0.1/SRC_ADMIN_PACKAGE_OVERVIEW_20260313.html",
      "localHash": "sha256:8f925d143f6d272c62c48a8de45b748bc72a4a9fb9908b32769c43b73aaaa10d",
      "retrievedAt": "2026-06-06T22:03:12Z",
      "sourceType": "government_primary",
      "notes": "Official Federal Council overview: on 13 March 2026 the Federal Council submitted the Switzerland-EU package to Parliament; Parliament is now considering it; if there is a referendum, the population votes; the Federal Council requested optional-referendum treatment, with Parliament to decide."
    },
    {
      "id": "SRC_EDA_PACKAGE_TIMELINE_20260313",
      "url": "https://www.eda.admin.ch/de/weiterentwicklung-beziehungen-schweiz-eu",
      "archiveUrl": null,
      "localPath": "Docs/AGENTS/Reference_Dossiers/snapshots/bundesrat-shared/v0.1/SRC_EDA_PACKAGE_TIMELINE_20260313.html",
      "localHash": "sha256:9452766216fbb1b58b5972b54b406653458d5f32d6b74d481734e31f3e9d7358",
      "retrievedAt": "2026-06-06T22:03:12Z",
      "sourceType": "government_primary",
      "notes": "Official FDFA timeline/newsticker: the remaining package agreements were signed in Brussels on 2 March 2026; the programme agreement was signed on 10 November 2025 and could be applied retroactively from early 2025; after paraphing comes signature and then ratification, including treatment by the Federal Assembly and any popular vote."
    },
    {
      "id": "SRC_ADMIN_SIGNING_20260302",
      "url": "https://www.admin.ch/de/newnsb/afSUBKNIaRs3s1tqaCebd",
      "archiveUrl": null,
      "localPath": "Docs/AGENTS/Reference_Dossiers/snapshots/bundesrat-shared/v0.1/SRC_ADMIN_SIGNING_20260302.html",
      "localHash": "sha256:efb42f6817183eae1e6ea4a77236dbcd21ee09f5165bec88479002def6bd8059",
      "retrievedAt": "2026-06-06T22:03:12Z",
      "sourceType": "government_primary",
      "notes": "Official 25 February 2026 Federal Council notice: announced that Federal President Guy Parmelin and Commission President Ursula von der Leyen would sign the Switzerland-EU package agreements in Brussels on 2 March 2026; the remaining agreements/protocols and a joint declaration were to form part of the March 2026 dispatch to Parliament."
    },
    {
      "id": "SRC_ADMIN_EUPA_20250410",
      "url": "https://www.admin.ch/de/nsb?id=105609",
      "archiveUrl": null,
      "localPath": "Docs/AGENTS/Reference_Dossiers/snapshots/bundesrat-rechtskraftig/v0.1/SRC_ADMIN_EUPA_20250410.html",
      "localHash": "sha256:8ca6ad791b1ece119d30ddf8ec1ec543998a5c5abd24838b9990922c0be18214",
      "retrievedAt": "2026-06-06T22:03:12Z",
      "sourceType": "government_primary",
      "notes": "Official 10 April 2025 notice: the EU programme agreement enters into force with ratification of the package, while signature enables retroactive association to selected EU programmes from 1 January 2025."
    },
    {
      "id": "SRC_EDA_LAW_RELATION_20260201",
      "url": "https://www.eda.admin.ch/de/das-verhaeltnis-von-voelkerrecht-und-landesrecht",
      "archiveUrl": null,
      "localPath": "Docs/AGENTS/Reference_Dossiers/snapshots/bundesrat-shared/v0.1/SRC_EDA_LAW_RELATION_20260201.html",
      "localHash": "sha256:8f1b3c5b1672587a36a29a95219345da9aed457461acd7fb8b79c6464a8c3bf2",
      "retrievedAt": "2026-06-06T22:03:12Z",
      "sourceType": "government_primary",
      "notes": "Official FDFA explainer: international-law norms accepted by Switzerland gain domestic effect when domestic approval procedures are complete and the international norm is also in force."
    }
  ],
  "interpretationFrames": [
    {
      "id": "FRAME_final_binding_entry_into_force",
      "label": "Rechtskräftig as final binding force / entry into force",
      "interpretedTermOrFrame": "rechtskräftig",
      "interpretationDefinition": "The term is read as final legal binding force for Switzerland: domestic approval is complete, ratification or equivalent consent has occurred where required, and the relevant international obligations are in force for Switzerland. The input's 'EU-Vertrag' referent is treated in v0.1 as the 2026 Switzerland-EU package/Bilaterals III, not as an EU membership treaty; a report using another referent must disclose that choice.",
      "frameRole": "primary",
      "frameAggregationMode": "dominance_weighted",
      "admissibility": "defensible",
      "admissibilityRationale": "This is the strict legal/procedural reading of the user's word 'rechtskräftig'. It separates the act of signature from final domestic approval, ratification, and entry into force.",
      "ambiguityPolicy": "must_disclose",
      "atomicityProfile": {
        "determinability": "determinable",
        "determinabilityStatus": "settled",
        "determinabilityRationale": "Under this frame, the input decomposes into independently verifiable conditions: signature, parliamentary decision status, popular decision status, and final binding/entry-into-force status. Each can be true or false under different evidence.",
        "distinctTruthConditions": [
          {
            "id": "TC_SIGNATURE_OCCURRED",
            "description": "Whether Switzerland/EU signed the relevant package agreements or programme agreement.",
            "dominanceRole": "supporting",
            "dominanceWeight": 0.1,
            "independentAssessabilityRequired": true,
            "mergeAllowedWith": []
          },
          {
            "id": "TC_PARLIAMENT_DECISION_PENDING",
            "description": "Whether the Federal Assembly had not yet decided on approval when the relevant signing occurred.",
            "dominanceRole": "supporting",
            "dominanceWeight": 0.2,
            "independentAssessabilityRequired": true,
            "mergeAllowedWith": []
          },
          {
            "id": "TC_POPULAR_DECISION_PENDING",
            "description": "Whether the people had not yet voted/decided when the relevant signing occurred, noting that a popular vote is contingent on a referendum.",
            "dominanceRole": "supporting",
            "dominanceWeight": 0.2,
            "independentAssessabilityRequired": true,
            "mergeAllowedWith": []
          },
          {
            "id": "TC_FINAL_BINDING_NOT_REACHED",
            "description": "Whether final legally binding force / entry into force had not yet been reached at signature under the ratification-reserved package path.",
            "dominanceRole": "dominant",
            "dominanceWeight": 0.5,
            "independentAssessabilityRequired": true,
            "mergeAllowedWith": []
          },
          {
            "id": "TC_PACKAGE_OBJECT",
            "description": "Whether the object is a multi-agreement package rather than one single EU membership treaty.",
            "dominanceRole": "context",
            "dominanceWeight": null,
            "independentAssessabilityRequired": false,
            "mergeAllowedWith": []
          },
          {
            "id": "TC_UNQUALIFIED_RECHTSKRAEFTIG_TOPLINE",
            "description": "Whether the unqualified claim that the Federal Council signed the EU package rechtskräftig before Parliament and the people decided is true overall, given the true chronology, false final-binding reading, and limited-effect caveats.",
            "dominanceRole": "aggregate_topline",
            "dominanceWeight": 1,
            "independentAssessabilityRequired": true,
            "mergeAllowedWith": []
          }
        ]
      },
      "referenceAssertions": [
        {
          "id": "RA_PACKAGE_SIGNATURE_OCCURRED",
          "truthConditionId": "TC_SIGNATURE_OCCURRED",
          "text": "The remaining agreements, protocols, and a joint declaration of the Switzerland-EU package were signed on 2 March 2026.",
          "role": "required",
          "separability": "strict",
          "kind": "procedural",
          "truthBand": {
            "min": 86,
            "max": 100
          },
          "confidenceBand": {
            "min": 80,
            "max": 95
          },
          "acceptedVerdictLabels": [
            "TRUE"
          ],
          "freshnessRequirement": "current_snapshot",
          "relevantGeographies": [
            "Switzerland",
            "European Union"
          ],
          "evidenceSourceIds": [
            "SRC_ADMIN_PACKAGE_OVERVIEW_20260313",
            "SRC_EDA_PACKAGE_TIMELINE_20260313",
            "SRC_ADMIN_SIGNING_20260302"
          ],
          "knownCounterEvidenceSourceIds": [],